{
  "auditEventId": "AUD-001",
  "requestId": "REQ-001",
  "traceId": "4bf92f0000000001",
  "agentId": "LOAN-AGENT-01",
  "agentRunId": "RUN-001",
  "employeeId": "EMP-101",
  "caseId": "LOAN-2026-001",
  "passportId": "PASS-001",
  "targetConsumerId": "CUST-1001",
  "requestedTool": "CREDIT_SCORE_READ",
  "requestedData": [
    "CREDIT_SCORE"
  ],
  "scopeStatus": {
    "employeeAuthority": "OK",
    "permissionTemplate": "OK",
    "caseStatus": "OK",
    "mandate": "OK",
    "passportStatus": "OK",
    "agentBinding": "OK",
    "customerScope": "OK",
    "toolScope": "OK",
    "dataScope": "OK"
  },
  "promptRiskEvaluationStatus": "EVALUATED",
  "promptRisk": 0.05,
  "promptRiskLevel": "LOW",
  "promptModelVersion": "prompt-guard-6",
  "behaviorRisk": 0.21,
  "behaviorRiskLevel": "LOW",
  "behaviorFeatureVersion": "behavior-features-1",
  "behaviorModelVersion": "iforest-1",
  "severity": "LOW",
  "riskFlagged": false,
  "decision": "ALLOW",
  "reasonCodes": [],
  "policyVersion": "loan-review-policy-1",
  "systemOutcome": "COMPLETED",
  "downstreamReached": true,
  "responseReleased": true,
  "success": true,
  "recordsRead": 1,
  "latencyMs": 120,
  "status": "COMPLETED",
  "requestedAt": "2026-08-17T21:32:10+09:00",
  "completedAt": "2026-08-17T21:32:11+09:00",
  "outcomeUnknownDetectedAt": "2026-08-17T21:33:15+09:00",
  "outcomeResolvedAt": "2026-08-17T21:34:02+09:00"
}
