{
  "auditEventId": "AUD-002",
  "requestId": "REQ-002",
  "traceId": "4bf92f0000000001",
  "agentId": "LOAN-AGENT-01",
  "agentRunId": "RUN-002",
  "status": "OUTCOME_UNKNOWN",
  "requestedAt": "2026-08-17T21:32:10+09:00",
  "employeeId": "EMP-101",
  "caseId": "LOAN-2026-001",
  "passportId": "PASS-001",
  "targetConsumerId": "CUST-1001",
  "requestedTool": "CREDIT_SCORE_READ",
  "requestedData": [
    "CREDIT_SCORE"
  ],
  "scopeStatus": {
    "employeeAuthority": "OK",
    "permissionTemplate": "OK",
    "caseStatus": "OK",
    "mandate": "OK",
    "passportStatus": "OK",
    "agentBinding": "OK",
    "customerScope": "OK",
    "toolScope": "OK",
    "dataScope": "OK"
  },
  "promptRiskEvaluationStatus": "EVALUATED",
  "promptRisk": 0.05,
  "promptRiskLevel": "LOW",
  "promptModelVersion": "prompt-guard-6",
  "reasonCodes": [],
  "outcomeUnknownDetectedAt": "2026-08-17T21:33:15+09:00"
}
